{"v": 4,"type":"state","src":"core","seq":40420,"t_ms":305000,
 "p":{"hazard":"mid","presence":"present","lock":"locked_danger","lock_release_left_s":7,
      "fan":{"level":1,"min":1,"requested":0,"ack":true},
      "induction":{"level":0,"allowed_on":false,"ack":true},
      "sensors":{"thermal":{"valid":true,"max_c":45.4,"median_c":28.4,"metric":17.0},
                 "pm":{"valid":true,"pm25":14.0,"tsize":0.58,"baseline":12.0}},
      "vision":{"fresh":true,"person":true,"cat":false},
      "voice":null,
      "reasons":["TEMP_MID","ACK_WAIT"],
      "alert":"NONE",
      "thresholds":{"t_mid":16,"t_high":22,"t_danger":30,"pm_warn":30,"pm_smoke":50,"lock_release_s":10},
      "uptime_s":1012}}
