{
  "v": 4,
  "type": "state",
  "src": "core",
  "seq": 120,
  "t_ms": 61000,
  "p": {
    "hazard": "low",
    "presence": "present",
    "lock": "unlocked",
    "lock_release_left_s": null,
    "fan": {
      "level": 0,
      "min": 0,
      "requested": 0,
      "ack": true
    },
    "induction": {
      "level": 2,
      "allowed_on": true,
      "ack": true
    },
    "sensors": {
      "thermal": {
        "valid": true,
        "max_c": 36.1,
        "median_c": 27.9,
        "metric": 8.2
      },
      "pm": {
        "valid": true,
        "pm25": 9.0,
        "tsize": 0.71,
        "baseline": 9.4
      }
    },
    "vision": {
      "fresh": true,
      "person": true,
      "cat": false
    },
    "voice": {
      "last_intent": "IND_SET",
      "value": 2,
      "accepted": true,
      "reason": null
    },
    "reasons": [],
    "alert": "NONE",
    "thresholds": {
      "t_mid": 16,
      "t_high": 22,
      "t_danger": 30,
      "pm_warn": 30,
      "pm_smoke": 50,
      "lock_release_s": 10
    },
    "uptime_s": 61
  }
}
