{"v": 4,"type":"state","src":"core","seq":40211,"t_ms":200500,
 "p":{"hazard":"high","presence":"absent","lock":"locked_cat","lock_release_left_s":null,
      "fan":{"level":3,"min":3,"requested":1,"ack":true},
      "induction":{"level":0,"allowed_on":false,"ack":true},
      "sensors":{"thermal":{"valid":true,"max_c":52.4,"median_c":28.4,"metric":24.0},
                 "pm":{"valid":true,"pm25":18.0,"tsize":0.62,"baseline":12.0}},
      "vision":{"fresh":true,"person":false,"cat":true},
      "voice":{"last_intent":"IND_ON","value":null,"accepted":false,"reason":"LOCKED"},
      "reasons":["TEMP_HIGH","ABSENT","CAT_NEAR"],
      "alert":"CAT_LOCK",
      "thresholds":{"t_mid":16,"t_high":22,"t_danger":30,"pm_warn":30,"pm_smoke":50,"lock_release_s":10},
      "uptime_s":812}}
